[
 {
  "gpu_id": "nvidia-gtx-1080-ti",
  "component_type": "gpu",
  "vendor": "NVIDIA",
  "architecture": "Pascal",
  "series": "GTX 10",
  "display_name": "GTX 1080 Ti",
  "release_year": 2017,
  "msrp_usd": null,
  "tdp_w": 250,
  "vram_gb": 11,
  "is_active": true,
  "benchmarks": {
   "1440p": {
    "raster": {
     "fps": 34.0,
     "raw_fps": 50.2,
     "pct_of_top": 20.3,
     "suite_version": "2022",
     "normalized": true
    }
   }
  },
  "rankings": {
   "1440p_raster": {
    "rank": 53,
    "cost_per_fps": 11.735,
    "zone": "unplayable"
   }
  },
  "current_price": {
   "price": 399.0,
   "retailer": "newegg",
   "url": "https://click.linksynergy.com/link?id=vnDw7makTWM&offerid=1786142.445832532149954141489024&type=15&murl=https%3A%2F%2Fwww.newegg.com%2Fp%2F13K-00BU-007G0%3Fitem%3D9SIB4VJG5T1259",
   "condition": "new",
   "fetched_at": "2026-10-17T14:03:50Z"
  },
  "retailer_links": {
   "newegg": "https://www.newegg.com/p/pl?d=GeForce+GTX+1080+Ti&N=100007709",
   "amazon": "https://www.amazon.com/s?k=GeForce+GTX+1080+Ti&i=computers",
   "bestbuy": "https://www.bestbuy.com/site/searchpage.jsp?st=GeForce+GTX+1080+Ti"
  },
  "price_stats": {
   "min_90d": 399.0,
   "median_90d": 419.0,
   "n_points": 4
  }
 },
 {
  "gpu_id": "nvidia-rtx-2060",
  "component_type": "gpu",
  "vendor": "NVIDIA",
  "architecture": "Turing",
  "series": "RTX 20",
  "display_name": "RTX 2060",
  "release_year": 2019,
  "msrp_usd": null,
  "tdp_w": 160,
  "vram_gb": 6,
  "is_active": true,
  "benchmarks": {
   "1440p": {
    "raster": {
     "fps": 24.0,
     "raw_fps": 40.1,
     "pct_of_top": 14.3,
     "suite_version": "2022",
     "normalized": true
    }
   }
  },
  "rankings": {
   "1440p_raster": {
    "rank": 61,
    "cost_per_fps": 24.958,
    "zone": "unplayable"
   }
  },
  "current_price": {
   "price": 599.0,
   "retailer": "newegg",
   "url": "https://click.linksynergy.com/link?id=vnDw7makTWM&offerid=1786142.445836279660597431036477&type=15&murl=https%3A%2F%2Fwww.newegg.com%2Fp%2F231-00CW-000B3%3Fitem%3D9SIB4VJG5T0704",
   "condition": "new",
   "fetched_at": "2026-10-17T14:03:50Z"
  },
  "retailer_links": {
   "newegg": "https://www.newegg.com/p/pl?d=GeForce+RTX+2060&N=100007709",
   "amazon": "https://www.amazon.com/s?k=GeForce+RTX+2060&i=computers",
   "bestbuy": "https://www.bestbuy.com/site/searchpage.jsp?st=GeForce+RTX+2060"
  },
  "price_stats": {
   "min_90d": 599.0,
   "median_90d": 599.0,
   "n_points": 2
  }
 },
 {
  "gpu_id": "nvidia-rtx-2060-super",
  "component_type": "gpu",
  "vendor": "NVIDIA",
  "architecture": "Turing",
  "series": "RTX 20",
  "display_name": "RTX 2060 Super",
  "release_year": 2019,
  "msrp_usd": null,
  "tdp_w": 175,
  "vram_gb": 8,
  "is_active": true,
  "benchmarks": {
   "1440p": {
    "raster": {
     "fps": 32.1,
     "raw_fps": 48.3,
     "pct_of_top": 19.2,
     "suite_version": "2022",
     "normalized": true
    }
   }
  },
  "rankings": {
   "1440p_raster": {
    "rank": 60,
    "cost_per_fps": 18.318,
    "zone": "unplayable"
   }
  },
  "current_price": {
   "price": 588.0,
   "retailer": "newegg",
   "url": "https://www.newegg.com/pny-technologies-inc-geforce-rtx-2060-8gb-graphics-card/p/1FT-000P-003P0?Item=9SIB4VJKP93706",
   "condition": "new",
   "fetched_at": "2026-03-06T00:00:00Z"
  },
  "retailer_links": {
   "newegg": "https://www.newegg.com/p/pl?d=GeForce+RTX+2060+Super&N=100007709",
   "amazon": "https://www.amazon.com/s?k=GeForce+RTX+2060+Super&i=computers",
   "bestbuy": "https://www.bestbuy.com/site/searchpage.jsp?st=GeForce+RTX+2060+Super"
  },
  "price_stats": {
   "min_90d": null,
   "median_90d": null,
   "n_points": 0
  }
 },
 {
  "gpu_id": "nvidia-rtx-2070",
  "component_type": "gpu",
  "vendor": "NVIDIA",
  "architecture": "Turing",
  "series": "RTX 20",
  "display_name": "RTX 2070",
  "release_year": 2018,
  "msrp_usd": null,
  "tdp_w": 185,
  "vram_gb": 8,
  "is_active": true,
  "benchmarks": {
   "1440p": {
    "raster": {
     "fps": 35.6,
     "raw_fps": 51.8,
     "pct_of_top": 21.3,
     "suite_version": "2022",
     "normalized": true
    }
   }
  },
  "rankings": {
   "1440p_raster": {
    "rank": 57,
    "cost_per_fps": 13.904,
    "zone": "unplayable"
   }
  },
  "current_price": {
   "price": 495.0,
   "retailer": "newegg",
   "url": "https://click.linksynergy.com/link?id=vnDw7makTWM&offerid=1786142.445831359151214423997595&type=15&murl=https%3A%2F%2Fwww.newegg.com%2Fp%2F1B4-00GA-000P2%3Fitem%3D9SIB1PGH884535",
   "condition": "new",
   "fetched_at": "2026-10-17T14:03:50Z"
  },
  "retailer_links": {
   "newegg": "https://www.newegg.com/p/pl?d=GeForce+RTX+2070&N=100007709",
   "amazon": "https://www.amazon.com/s?k=GeForce+RTX+2070&i=computers",
   "bestbuy": "https://www.bestbuy.com/site/searchpage.jsp?st=GeForce+RTX+2070"
  },
  "price_stats": {
   "min_90d": 495.0,
   "median_90d": 495.0,
   "n_points": 2
  }
 },
 {
  "gpu_id": "nvidia-rtx-2070-super",
  "component_type": "gpu",
  "vendor": "NVIDIA",
  "architecture": "Turing",
  "series": "RTX 20",
  "display_name": "RTX 2070 Super",
  "release_year": 2019,
  "msrp_usd": null,
  "tdp_w": 215,
  "vram_gb": 8,
  "is_active": true,
  "benchmarks": {
   "1440p": {
    "raster": {
     "fps": 43.5,
     "raw_fps": 59.8,
     "pct_of_top": 26.0,
     "suite_version": "2022",
     "normalized": true
    }
   }
  },
  "rankings": {
   "1440p_raster": {
    "rank": 59,
    "cost_per_fps": 17.126,
    "zone": "unplayable"
   }
  },
  "current_price": {
   "price": 745.0,
   "retailer": "newegg",
   "url": "https://www.newegg.com/msi-rtx-2070-super-gaming-z-trio-geforce-rtx-2070-super-8gb-graphics-card-triple-fans/p/N82E16814137487?Item=9SIB4VJKMG7528",
   "condition": "new",
   "fetched_at": "2026-03-06T00:00:00Z"
  },
  "retailer_links": {
   "newegg": "https://www.newegg.com/p/pl?d=GeForce+RTX+2070+Super&N=100007709",
   "amazon": "https://www.amazon.com/s?k=GeForce+RTX+2070+Super&i=computers",
   "bestbuy": "https://www.bestbuy.com/site/searchpage.jsp?st=GeForce+RTX+2070+Super"
  },
  "price_stats": {
   "min_90d": null,
   "median_90d": null,
   "n_points": 0
  }
 },
 {
  "gpu_id": "nvidia-rtx-2080",
  "component_type": "gpu",
  "vendor": "NVIDIA",
  "architecture": "Turing",
  "series": "RTX 20",
  "display_name": "RTX 2080",
  "release_year": 2018,
  "msrp_usd": null,
  "tdp_w": 215,
  "vram_gb": 8,
  "is_active": true,
  "benchmarks": {
   "1440p": {
    "raster": {
     "fps": 46.8,
     "raw_fps": 63.2,
     "pct_of_top": 28.0,
     "suite_version": "2022",
     "normalized": true
    }
   }
  },
  "rankings": {
   "1440p_raster": {
    "rank": 45,
    "cost_per_fps": 18.141,
    "zone": "poor"
   }
  },
  "current_price": {
   "price": 849.0,
   "retailer": "newegg",
   "url": "https://click.linksynergy.com/link?id=vnDw7makTWM&offerid=1786142.44583905684453609714148&type=15&murl=https%3A%2F%2Fwww.newegg.com%2Fp%2F231-00BC-001D9%3Fitem%3D9SIB4VJG5T0528",
   "condition": "new",
   "fetched_at": "2026-10-17T14:03:50Z"
  },
  "retailer_links": {
   "newegg": "https://www.newegg.com/p/pl?d=GeForce+RTX+2080&N=100007709",
   "amazon": "https://www.amazon.com/s?k=GeForce+RTX+2080&i=computers",
   "bestbuy": "https://www.bestbuy.com/site/searchpage.jsp?st=GeForce+RTX+2080"
  },
  "price_stats": {
   "min_90d": 849.0,
   "median_90d": 855.0,
   "n_points": 4
  }
 },
 {
  "gpu_id": "nvidia-rtx-2080-super",
  "component_type": "gpu",
  "vendor": "NVIDIA",
  "architecture": "Turing",
  "series": "RTX 20",
  "display_name": "RTX 2080 Super",
  "release_year": 2019,
  "msrp_usd": null,
  "tdp_w": 250,
  "vram_gb": 8,
  "is_active": true,
  "benchmarks": {
   "1440p": {
    "raster": {
     "fps": 49.7,
     "raw_fps": 66.1,
     "pct_of_top": 29.7,
     "suite_version": "2022",
     "normalized": true
    }
   }
  },
  "rankings": {
   "1440p_raster": {
    "rank": 44,
    "cost_per_fps": 17.082,
    "zone": "poor"
   }
  },
  "current_price": {
   "price": 849.0,
   "retailer": "newegg",
   "url": "https://click.linksynergy.com/link?id=vnDw7makTWM&offerid=1786142.4458313762729352055953985&type=15&murl=https%3A%2F%2Fwww.newegg.com%2Fp%2F0ZK-010N-000F8%3Fitem%3D9SIB4VJG5T0014",
   "condition": "new",
   "fetched_at": "2026-10-17T14:03:50Z"
  },
  "retailer_links": {
   "newegg": "https://www.newegg.com/p/pl?d=GeForce+RTX+2080+Super&N=100007709",
   "amazon": "https://www.amazon.com/s?k=GeForce+RTX+2080+Super&i=computers",
   "bestbuy": "https://www.bestbuy.com/site/searchpage.jsp?st=GeForce+RTX+2080+Super"
  },
  "price_stats": {
   "min_90d": 849.0,
   "median_90d": 1729.0,
   "n_points": 4
  }
 },
 {
  "gpu_id": "nvidia-rtx-2080-ti",
  "component_type": "gpu",
  "vendor": "NVIDIA",
  "architecture": "Turing",
  "series": "RTX 20",
  "display_name": "RTX 2080 Ti",
  "release_year": 2018,
  "msrp_usd": null,
  "tdp_w": 250,
  "vram_gb": 11,
  "is_active": true,
  "benchmarks": {
   "1440p": {
    "raster": {
     "fps": 59.1,
     "raw_fps": 75.6,
     "pct_of_top": 35.3,
     "suite_version": "2022",
     "normalized": true
    }
   }
  },
  "rankings": {
   "1440p_raster": {
    "rank": 42,
    "cost_per_fps": 15.144,
    "zone": "poor"
   }
  },
  "current_price": {
   "price": 895.0,
   "retailer": "newegg",
   "url": "https://click.linksynergy.com/link?id=vnDw7makTWM&offerid=1786142.445836455928980405271927&type=15&murl=https%3A%2F%2Fwww.newegg.com%2Fp%2F2CX-005T-00004%3Fitem%3D9SIB4VJK367042",
   "condition": "new",
   "fetched_at": "2026-10-17T14:03:50Z"
  },
  "retailer_links": {
   "newegg": "https://www.newegg.com/p/pl?d=GeForce+RTX+2080+Ti&N=100007709",
   "amazon": "https://www.amazon.com/s?k=GeForce+RTX+2080+Ti&i=computers",
   "bestbuy": "https://www.bestbuy.com/site/searchpage.jsp?st=GeForce+RTX+2080+Ti"
  },
  "price_stats": {
   "min_90d": 895.0,
   "median_90d": 995.0,
   "n_points": 10
  }
 },
 {
  "gpu_id": "nvidia-rtx-3060",
  "component_type": "gpu",
  "vendor": "NVIDIA",
  "architecture": "Ampere",
  "series": "RTX 30",
  "display_name": "RTX 3060",